<?xml version="1.0" encoding="UTF-8"?>
<legespielConfiguration
	xmlns="http://whatsoftwarecando.org"
	xmlns:xsi="http://www.w3.org/2001/XMLSchema-instance"
xsi:schemaLocation="http://whatsoftwarecando.org/legespiel.config.xsd http://whatsoftwarecando.org">
	<name>4th Avenue</name>
	<description>Puzzland Hikimi (1980s), https://welt-der-geduldspiele.blogspot.com/2025/05/4th-avenue.html</description>
	<numberOfRows>4</numberOfRows>
	<numberOfColumns>4</numberOfColumns>
	<pictures>
		<picture id="1" name="Diamant" matchWithIds="1" />
		<picture id="2" name="Kreis" matchWithIds="2" />
		<picture id="3" name="Kreuz" matchWithIds="3" />
		<picture id="4" name="Quadrat" matchWithIds="4" />
		<picture id="5" name="Stein 1" matchWithIds="5" />
		<picture id="6" name="Stein 2" matchWithIds="6" />
		<picture id="7" name="Stein 3" matchWithIds="7" />
		<picture id="8" name="Stein 4" matchWithIds="8" />
		<picture id="9" name="Stein 5" matchWithIds="9" />
		<picture id="10" name="Stein 6" matchWithIds="10" />
		<picture id="11" name="Stein 7" matchWithIds="11" />
		<picture id="12" name="Stein 8" matchWithIds="12" />
	</pictures>
	<cards>
		<card north="1" west="3" east="2" south="5" />
		<card north="3" west="2" east="6" south="4" />
		<card north="2" west="6" east="4" south="3" />
		<card north="1" west="4" east="2" south="7" />
		<card north="5" west="2" east="3" south="1" />
		<card north="4" west="3" east="8" south="2" />
		<card north="3" west="8" east="2" south="4" />
		<card north="7" west="2" east="1" south="4" />
		<card north="1" west="3" east="9" south="2" />
		<card north="2" west="9" east="1" south="3" />
		<card north="4" west="2" east="1" south="12" />
		<card north="4" west="1" east="2" south="10" />
		<card north="12" west="1" east="4" south="2" />
		<card north="3" west="4" east="11" south="2" />
		<card north="2" west="11" east="4" south="3" />
		<card north="10" west="4" east="1" south="2" />
	</cards>
</legespielConfiguration>