<?xml version="1.0" encoding="UTF-8"?>
<legespielConfiguration
	xmlns="http://whatsoftwarecando.org"
	xmlns:xsi="http://www.w3.org/2001/XMLSchema-instance"
xsi:schemaLocation="http://whatsoftwarecando.org/legespiel.config.xsd http://whatsoftwarecando.org">
	<name>Japanisches Kartenrätsel - Sechsecke (einfache Variante)</name>
	<description>https://welt-der-geduldspiele.blogspot.com/2022/11/kartenratsel-sechsecke-einfache-variante.html</description>
	<numberOfRows>3</numberOfRows>
	<numberOfColumns>3</numberOfColumns>
	<pictures>
		<picture id="1" name="rot" matchWithIds="1" />
		<picture id="2" name="gelb" matchWithIds="2" />
		<picture id="3" name="grün" matchWithIds="3" />
		<picture id="4" name="blau" matchWithIds="4" />
	</pictures>
	<cards>
		<card north="3" west="2" east="1" south="3" />
		<card north="4" west="1" east="3" south="2" />
		<card north="4" west="3" east="1" south="2" />
		<card north="3" west="4" east="4" south="2" />
		<card north="2" west="4" east="3" south="1" />
		<card north="2" west="3" east="4" south="1" />
		<card north="2" west="3" east="4" south="1" />
		<card north="1" west="4" east="3" south="2" />
		<card north="1" west="2" east="3" south="4" />
	</cards>
</legespielConfiguration>