<?xml version="1.0" encoding="UTF-8"?>
<legespielConfiguration
	xmlns="http://whatsoftwarecando.org"
	xmlns:xsi="http://www.w3.org/2001/XMLSchema-instance"
xsi:schemaLocation="http://whatsoftwarecando.org/legespiel.config.xsd http://whatsoftwarecando.org">
	<name>Die Bärenknobelei</name>
	<description>https://welt-der-geduldspiele.blogspot.com/2023/03/die-barenknobelei.html</description>
	<numberOfRows>3</numberOfRows>
	<numberOfColumns>3</numberOfColumns>
	<pictures>
		<picture id="1" name="Eisbär Kopf" matchWithIds="2" />
		<picture id="2" name="Eisbär Hinterteil" matchWithIds="1" />
		<picture id="3" name="Grizzly Kopf" matchWithIds="4" />
		<picture id="4" name="Grizzly Hinterteil" matchWithIds="3" />
		<picture id="5" name="Braunbär Kopf" matchWithIds="6" />
		<picture id="6" name="Braunbär Hinterteil" matchWithIds="5" />
		<picture id="7" name="Panda Kopf" matchWithIds="8" />
		<picture id="8" name="Panda Hinterteil" matchWithIds="7" />
	</pictures>
	<cards>
		<card north="3" west="7" east="1" south="5" />
		<card north="6" west="2" east="7" south="4" />
		<card north="3" west="8" east="5" south="1" />
		<card north="6" west="2" east="7" south="4" />
		<card north="3" west="8" east="6" south="1" />
		<card north="2" west="5" east="3" south="8" />
		<card north="5" west="4" east="7" south="2" />
		<card north="2" west="4" east="6" south="8" />
		<card north="7" west="5" east="1" south="4" />
	</cards>
</legespielConfiguration>