<?xml version="1.0" encoding="UTF-8"?>
<legespielConfiguration
	xmlns="http://whatsoftwarecando.org"
	xmlns:xsi="http://www.w3.org/2001/XMLSchema-instance"
xsi:schemaLocation="http://whatsoftwarecando.org/legespiel.config.xsd http://whatsoftwarecando.org">
	<name>Das verflixte Felix Puzzle - Spiel</name>
	<description>Legespiel aus dem Jahr 1998
	Passend zu den Felix BÃ¼chern von Annette Langen
	Herausgegeben von &quot;Die Spielburg&quot; im Coppenrath Verlag</description>
	<numberOfRows>3</numberOfRows>
	<numberOfColumns>3</numberOfColumns>
	<pictures>
		<picture id="1" name="Astronautenkopf" matchWithIds="2" />
		<picture id="2" name="Astronautenpo" matchWithIds="1" />
		<picture id="3" name="Wikingerkopf" matchWithIds="4" />
		<picture id="4" name="Wikingerpo" matchWithIds="3" />
		<picture id="5" name="Hasenkopf" matchWithIds="6" />
		<picture id="6" name="Hasenpo" matchWithIds="5" />
		<picture id="7" name="Schwimmerkopf" matchWithIds="8" />
		<picture id="8" name="Schwimmerpo" matchWithIds="7" />
	</pictures>
	<cards>
		<card north="8" west="4" east="7" south="5" />
		<card north="2" west="8" east="5" south="3" />
		<card north="2" west="7" east="4" south="5" />
		<card north="4" west="7" east="8" south="5" />
		<card north="1" west="5" east="4" south="2" />
		<card north="4" west="8" east="7" south="1" />
		<card north="3" west="7" east="6" south="2" />
		<card north="3" west="5" east="6" south="2" />
		<card north="1" west="7" east="6" south="4" />
	</cards>
</legespielConfiguration>