<?xml version="1.0" encoding="UTF-8"?>
<legespielConfiguration
	xmlns="http://whatsoftwarecando.org"
	xmlns:xsi="http://www.w3.org/2001/XMLSchema-instance"
	xsi:schemaLocation="http://whatsoftwarecando.org/legespiel.config.xsd http://whatsoftwarecando.org">
	<name>Uli Stein: Noch verwzickter geht nicht!</name>
	<description>See http://www.gerdkoch.de/nochverwzickter/index.html for more information.</description>
	<numberOfRows>3</numberOfRows>
	<numberOfColumns>3</numberOfColumns>
	<pictures>
		<picture id="1" name="GLASS RIGHT" matchWithIds="6" />
		<picture id="2" name="REACHING RIGHT" matchWithIds="7" />
		<picture id="3" name="FOOTBALL LEFT" matchWithIds="5" />
		<picture id="4" name="TEA LEFT" matchWithIds="8" />
		<picture id="5" name="FOOTBALL RIGHT" matchWithIds="3" />
		<picture id="6" name="GLASS LEFT" matchWithIds="1" />
		<picture id="7" name="REACHING LEFT" matchWithIds="2" />
		<picture id="8" name="TEA RIGHT" matchWithIds="4" />
	</pictures>
	<cards>
		<card north="1" west="2" east="3" south="4" />
		<card north="4" west="5" east="2" south="6" />
		<card north="5" west="7" east="6" south="8" />
		<card north="8" west="6" east="2" south="3" />
		<card north="1" west="7" east="3" south="8" />
		<card north="4" west="5" east="7" south="1" />
		<card north="5" west="4" east="6" south="2" />
		<card north="4" west="1" east="7" south="5" />
		<card north="6" west="2" east="8" south="3" />
	</cards>
</legespielConfiguration>