<?xml version="1.0" encoding="UTF-8"?>
<legespielConfiguration
	xmlns="http://whatsoftwarecando.org"
	xmlns:xsi="http://www.w3.org/2001/XMLSchema-instance"
xsi:schemaLocation="http://whatsoftwarecando.org/legespiel.config.xsd http://whatsoftwarecando.org">
	<name>Duckula der Verflixte</name>
	<description>Quasthoff version 2</description>
	<numberOfRows>3</numberOfRows>
	<numberOfColumns>3</numberOfColumns>
	<pictures>
		<picture id="1" name="Turned around upper" matchWithIds="2" />
		<picture id="2" name="Turned around lower" matchWithIds="1" />
		<picture id="3" name="Scared upper" matchWithIds="4" />
		<picture id="4" name="Scared lower" matchWithIds="3" />
		<picture id="5" name="Eyes covered upper" matchWithIds="6" />
		<picture id="6" name="Eyes covered lower" matchWithIds="5" />
		<picture id="7" name="Happy upper" matchWithIds="8" />
		<picture id="8" name="Happy lower" matchWithIds="7" />
	</pictures>
	<cards>
		<card north="2" west="4" east="3" south="7" />
		<card north="2" west="4" east="5" south="7" />
		<card north="4" west="6" east="1" south="7" />
		<card north="8" west="6" east="5" south="1" />
		<card north="8" west="6" east="3" south="1" />
		<card north="8" west="4" east="1" south="5" />
		<card north="2" west="4" east="5" south="7" />
		<card north="2" west="6" east="3" south="7" />
		<card north="6" west="4" east="7" south="1" />
	</cards>
</legespielConfiguration>