<?xml version="1.0" encoding="UTF-8"?>
<legespielConfiguration
	xmlns="http://whatsoftwarecando.org"
	xmlns:xsi="http://www.w3.org/2001/XMLSchema-instance"
xsi:schemaLocation="http://whatsoftwarecando.org/legespiel.config.xsd http://whatsoftwarecando.org">
	<name>W채hrungs-T체ftelspiel (Vorderseite)</name>
	<description>https://welt-der-geduldspiele.blogspot.com/2024/04/wahrungs-tuftelspiel-vorderseite.html</description>
	<numberOfRows>3</numberOfRows>
	<numberOfColumns>3</numberOfColumns>
	<pictures>
		<picture id="1" name="blau links" matchWithIds="2" />
		<picture id="2" name="blau rechts" matchWithIds="1" />
		<picture id="3" name="braun links" matchWithIds="4" />
		<picture id="4" name="braun rechts" matchWithIds="3" />
		<picture id="5" name="dollar links" matchWithIds="6" />
		<picture id="6" name="dollar rechts" matchWithIds="5" />
		<picture id="7" name="gr체n links" matchWithIds="8" />
		<picture id="8" name="gr체n rechts" matchWithIds="7" />
	</pictures>
	<cards>
		<card north="7" west="2" east="3" south="6" />
		<card north="6" west="4" east="7" south="1" />
		<card north="6" west="8" east="1" south="3" />
		<card north="3" west="4" east="3" south="2" />
		<card north="2" west="4" east="5" south="7" />
		<card north="4" west="6" east="1" south="7" />
		<card north="1" west="4" east="5" south="8" />
		<card north="8" west="6" east="5" south="1" />
		<card north="8" west="6" east="3" south="1" />
	</cards>
</legespielConfiguration>