<?xml version="1.0" encoding="UTF-8"?>
<legespielConfiguration
	xmlns="http://whatsoftwarecando.org"
	xmlns:xsi="http://www.w3.org/2001/XMLSchema-instance"
xsi:schemaLocation="http://whatsoftwarecando.org/legespiel.config.xsd http://whatsoftwarecando.org">
	<name>Werner-Knobelei</name>
	<description>https://welt-der-geduldspiele.blogspot.com/2023/10/werner-knobelei.html</description>
	<numberOfRows>3</numberOfRows>
	<numberOfColumns>3</numberOfColumns>
	<pictures>
		<picture id="1" name="Werner oben" matchWithIds="2" />
		<picture id="2" name="Werner unten" matchWithIds="1" />
		<picture id="3" name="MC Klappstuhl oben" matchWithIds="4" />
		<picture id="4" name="MC Klappstuhl unten" matchWithIds="3" />
		<picture id="5" name="Andi oben" matchWithIds="6" />
		<picture id="6" name="Andi unten" matchWithIds="5" />
		<picture id="7" name="Kalli oben" matchWithIds="8" />
		<picture id="8" name="Kalli unten" matchWithIds="7" />
	</pictures>
	<cards>
		<card north="1" west="6" east="4" south="7" />
		<card north="5" west="3" east="2" south="8" />
		<card north="1" west="1" east="6" south="7" />
		<card north="8" west="3" east="2" south="5" />
		<card north="7" west="1" east="4" south="6" />
		<card north="8" west="3" east="5" south="2" />
		<card north="6" west="4" east="1" south="7" />
		<card north="5" west="2" east="8" south="3" />
		<card north="2" west="3" east="5" south="8" />
	</cards>
</legespielConfiguration>