<?xml version="1.0" encoding="UTF-8"?>
<legespielConfiguration
	xmlns="http://whatsoftwarecando.org"
	xmlns:xsi="http://www.w3.org/2001/XMLSchema-instance"
xsi:schemaLocation="http://whatsoftwarecando.org/legespiel.config.xsd http://whatsoftwarecando.org">
	<name>Astro Aquarius</name>
	<description>Verlag Lemada, Israel, 1981</description>
	<numberOfRows>3</numberOfRows>
	<numberOfColumns>3</numberOfColumns>
	<pictures>
		<picture id="1" name="Rot Kopf" matchWithIds="2" />
		<picture id="2" name="Rot Fuss" matchWithIds="1" />
		<picture id="3" name="Grün Kopf" matchWithIds="4" />
		<picture id="4" name="Grün Fuss" matchWithIds="3" />
		<picture id="5" name="Gelb Kopf" matchWithIds="6" />
		<picture id="6" name="Gelb Fuss" matchWithIds="5" />
		<picture id="7" name="Blau Kopf" matchWithIds="8" />
		<picture id="8" name="Blau Fuss" matchWithIds="7" />
	</pictures>
	<cards>
		<card north="1" west="2" east="2" south="7" />
		<card north="1" west="2" east="7" south="7" />
		<card north="4" west="5" east="4" south="1" />
		<card north="5" west="8" east="1" south="4" />
		<card north="6" west="7" east="6" south="3" />
		<card north="6" west="3" east="2" south="5" />
		<card north="7" west="3" east="1" south="6" />
		<card north="7" west="3" east="6" south="1" />
		<card north="5" west="8" east="5" south="4" />
	</cards>
</legespielConfiguration>