<?xml version="1.0" encoding="UTF-8"?>
<legespielConfiguration
	xmlns="http://whatsoftwarecando.org"
	xmlns:xsi="http://www.w3.org/2001/XMLSchema-instance"
xsi:schemaLocation="http://whatsoftwarecando.org/legespiel.config.xsd http://whatsoftwarecando.org">
	<name>Child&apos;s Puzzle Three / Kinderpuzzle Nr. 3</name>
	<description>https://welt-der-geduldspiele.blogspot.com/2023/04/childs-puzzle-three-kinderpuzzle-nr-3.html</description>
	<numberOfRows>3</numberOfRows>
	<numberOfColumns>3</numberOfColumns>
	<pictures>
		<picture id="1" name="Anker rechts" matchWithIds="2" />
		<picture id="2" name="Anker links" matchWithIds="1" />
		<picture id="3" name="Eule rechts" matchWithIds="4" />
		<picture id="4" name="Eule links" matchWithIds="3" />
		<picture id="5" name="Fisch rechts" matchWithIds="6" />
		<picture id="6" name="Fisch links" matchWithIds="5" />
		<picture id="7" name="Mensch rechts" matchWithIds="8" />
		<picture id="8" name="Mensch links" matchWithIds="7" />
	</pictures>
	<cards>
		<card north="2" west="1" east="6" south="8" />
		<card north="6" west="5" east="4" south="3" />
		<card north="8" west="3" east="1" south="5" />
		<card north="7" west="5" east="6" south="4" />
		<card north="4" west="5" east="6" south="7" />
		<card north="6" west="5" east="3" south="1" />
		<card north="3" west="7" east="4" south="2" />
		<card north="8" west="3" east="1" south="4" />
		<card north="5" west="2" east="4" south="7" />
	</cards>
</legespielConfiguration>