<?xml version="1.0" encoding="UTF-8"?>
<legespielConfiguration
	xmlns="http://whatsoftwarecando.org"
	xmlns:xsi="http://www.w3.org/2001/XMLSchema-instance"
xsi:schemaLocation="http://whatsoftwarecando.org/legespiel.config.xsd http://whatsoftwarecando.org">
	<name>Lemon and Herbs</name>
	<description>MDF Coasters - The solution could not be verified, because the image on Amazon seems to be incorrect: https://www.amazon.com/Piece-Scramble-Square-Puzzle-Housewarming/dp/B0CCMLSQLS?th=1</description>
	<numberOfRows>3</numberOfRows>
	<numberOfColumns>3</numberOfColumns>
	<pictures>
		<picture id="1" name="Olive 1" matchWithIds="8" />
		<picture id="2" name="Lemon Dark" matchWithIds="7" />
		<picture id="3" name="Mint Stem" matchWithIds="6" />
		<picture id="4" name="Rosemary Stem" matchWithIds="5" />
		<picture id="5" name="Rosemary Top" matchWithIds="4" />
		<picture id="6" name="Mint Top" matchWithIds="3" />
		<picture id="7" name="Lemon Light" matchWithIds="2" />
		<picture id="8" name="Olive 2" matchWithIds="1" />
	</pictures>
	<cards>
		<card north="8" west="6" east="2" south="4" />
		<card north="6" west="1" east="5" south="2" />
		<card north="5" west="8" east="3" south="2" />
		<card north="3" west="1" east="8" south="5" />
		<card north="8" west="7" east="3" south="1" />
		<card north="1" west="8" east="3" south="5" />
		<card north="5" west="7" east="2" south="3" />
		<card north="2" west="5" east="4" south="6" />
		<card north="8" west="7" east="3" south="4" />
	</cards>
</legespielConfiguration>