<?xml version="1.0" encoding="UTF-8"?>
<legespielConfiguration
	xmlns="http://whatsoftwarecando.org"
	xmlns:xsi="http://www.w3.org/2001/XMLSchema-instance"
	xsi:schemaLocation="http://whatsoftwarecando.org/legespiel.config.xsd http://whatsoftwarecando.org">
	<name>Retriever Scramble Squares</name>
	<description>See https://kalmas.net/blog/2014-01-01_scramble-squares/</description>
	<numberOfRows>3</numberOfRows>
	<numberOfColumns>3</numberOfColumns>
	<pictures>
		<picture id="1" name="PANTING FRONT" matchWithIds="7" />
		<picture id="2" name="BLACK FRONT" matchWithIds="6" />
		<picture id="3" name="BROWN BACK" matchWithIds="5" />
		<picture id="4" name="WITH STICK FRONT" matchWithIds="8" />
		<picture id="5" name="BROWN FRONT" matchWithIds="3" />
		<picture id="6" name="BLACK BACK" matchWithIds="2" />
		<picture id="7" name="PANGTIN BACK" matchWithIds="1" />
		<picture id="8" name="WITH STICK BACK" matchWithIds="4" />
	</pictures>
	<cards>
		<card north="1" west="2" east="3" south="4" />
		<card north="4" west="5" east="1" south="6" />
		<card north="5" west="7" east="4" south="2" />
		<card north="8" west="5" east="1" south="2" />
		<card north="2" west="7" east="4" south="5" />
		<card north="6" west="8" east="7" south="3" />
		<card north="6" west="4" east="7" south="5" />
		<card north="3" west="1" east="8" south="2" />
		<card north="5" west="4" east="2" south="1" />
	</cards>
</legespielConfiguration>