<?xml version="1.0" encoding="UTF-8"?>
<legespielConfiguration
	xmlns="http://whatsoftwarecando.org"
	xmlns:xsi="http://www.w3.org/2001/XMLSchema-instance"
xsi:schemaLocation="http://whatsoftwarecando.org/legespiel.config.xsd http://whatsoftwarecando.org">
	<name>Space Web</name>
	<description>Space Web Arrangement Puzzle, Gordon Bros. 1979
	https://welt-der-geduldspiele.blogspot.com/2022/10/space-web.html</description>
	<numberOfRows>3</numberOfRows>
	<numberOfColumns>3</numberOfColumns>
	<pictures>
		<picture id="1" name="1" matchWithIds="4" />
		<picture id="2" name="2" matchWithIds="3" />
		<picture id="3" name="3" matchWithIds="2" />
		<picture id="4" name="4" matchWithIds="1" />
	</pictures>
	<cards>
		<card north="4" west="2" east="2" south="4" />
		<card north="1" west="3" east="3" south="1" />
		<card north="3" west="2" east="2" south="3" />
		<card north="1" west="1" east="3" south="3" />
		<card north="4" west="2" east="4" south="2" />
		<card north="2" west="1" east="3" south="4" />
		<card north="2" west="1" east="3" south="4" />
		<card north="3" west="2" east="2" south="3" />
		<card north="4" west="1" east="3" south="2" />
	</cards>
</legespielConfiguration>