<?xml version="1.0" encoding="UTF-8"?>
<legespielConfiguration
	xmlns="http://whatsoftwarecando.org"
	xmlns:xsi="http://www.w3.org/2001/XMLSchema-instance"
xsi:schemaLocation="http://whatsoftwarecando.org/legespiel.config.xsd http://whatsoftwarecando.org">
	<name>r-Spiel</name>
	<description>FÃ¶rderverein Gutenbergmuseum, Mainz</description>
	<numberOfRows>3</numberOfRows>
	<numberOfColumns>3</numberOfColumns>
	<pictures>
		<picture id="1" name="r1 oben" matchWithIds="2" />
		<picture id="2" name="r1 unten" matchWithIds="1" />
		<picture id="3" name="r2 oben" matchWithIds="4" />
		<picture id="4" name="r2 unten" matchWithIds="3" />
		<picture id="5" name="r3 oben" matchWithIds="6" />
		<picture id="6" name="r3 unten" matchWithIds="5" />
		<picture id="7" name="r4 oben" matchWithIds="8" />
		<picture id="8" name="r4 unten" matchWithIds="7" />
	</pictures>
	<cards>
		<card north="4" west="1" east="8" south="5" />
		<card north="4" west="7" east="6" south="1" />
		<card north="8" west="5" east="4" south="1" />
		<card north="6" west="3" east="8" south="1" />
		<card north="2" west="7" east="4" south="5" />
		<card north="6" west="3" east="2" south="1" />
		<card north="2" west="3" east="8" south="5" />
		<card north="6" west="7" east="4" south="5" />
		<card north="2" west="3" east="8" south="1" />
	</cards>
</legespielConfiguration>