<?xml version="1.0" encoding="UTF-8"?>
<legespielConfiguration
	xmlns="http://whatsoftwarecando.org"
	xmlns:xsi="http://www.w3.org/2001/XMLSchema-instance"
xsi:schemaLocation="http://whatsoftwarecando.org/legespiel.config.xsd http://whatsoftwarecando.org">
	<name>Harry Potter</name>
	<description>Head2Toe - www.advancegames.net 2020</description>
	<numberOfRows>3</numberOfRows>
	<numberOfColumns>3</numberOfColumns>
	<pictures>
		<picture id="1" name="Hufflepuff up" matchWithIds="2" />
		<picture id="2" name="Hufflepuff down" matchWithIds="1" />
		<picture id="3" name="Gryffindor up" matchWithIds="4" />
		<picture id="4" name="Gryffindor down" matchWithIds="3" />
		<picture id="5" name="Slytherin up" matchWithIds="6" />
		<picture id="6" name="Slytherin down" matchWithIds="5" />
		<picture id="7" name="Ravenclaw up" matchWithIds="8" />
		<picture id="8" name="Ravenclaw down" matchWithIds="7" />
	</pictures>
	<cards>
		<card north="3" west="5" east="4" south="2" />
		<card north="8" west="1" east="3" south="1" />
		<card north="8" west="6" east="6" south="7" />
		<card north="2" west="4" east="7" south="1" />
		<card north="2" west="3" east="3" south="6" />
		<card north="5" west="8" east="1" south="6" />
		<card north="5" west="8" east="8" south="4" />
		<card north="1" west="4" east="7" south="6" />
		<card north="3" west="2" east="5" south="7" />
	</cards>
</legespielConfiguration>