<?xml version="1.0" encoding="UTF-8"?>
<legespielConfiguration
	xmlns="http://whatsoftwarecando.org"
	xmlns:xsi="http://www.w3.org/2001/XMLSchema-instance"
xsi:schemaLocation="http://whatsoftwarecando.org/legespiel.config.xsd http://whatsoftwarecando.org">
	<name>Uli Stein - Tierisch VERZWICKT</name>
	<description>Uli Stein Legespiel von 1993</description>
	<numberOfRows>3</numberOfRows>
	<numberOfColumns>3</numberOfColumns>
	<pictures>
		<picture id="1" name="Katze oben" matchWithIds="2" />
		<picture id="2" name="Katze unten" matchWithIds="1" />
		<picture id="3" name="Maus oben" matchWithIds="4" />
		<picture id="4" name="Maus unten" matchWithIds="3" />
		<picture id="5" name="Pinguin oben" matchWithIds="6" />
		<picture id="6" name="Pinguin unten" matchWithIds="5" />
		<picture id="7" name="Schwein oben" matchWithIds="8" />
		<picture id="8" name="Schwein unten" matchWithIds="7" />
	</pictures>
	<cards>
		<card north="4" west="5" east="1" south="8" />
		<card north="2" west="6" east="7" south="3" />
		<card north="2" west="3" east="6" south="7" />
		<card north="4" west="1" east="8" south="5" />
		<card north="8" west="3" east="5" south="2" />
		<card north="6" west="4" east="8" south="1" />
		<card north="4" west="7" east="2" south="5" />
		<card north="1" west="8" east="3" south="7" />
		<card north="2" west="7" east="3" south="6" />
	</cards>
</legespielConfiguration>